name, link
Iola Jordan Child Care/PreK site, https://capitalplanning.nyc.gov/facilities/explorer#17.93/40.82424/-73.91316
Strong Place for Hope child care/early education, https://capitalplanning.nyc.gov/facilities/explorer#18.04/40.67405/-73.98354
Billy Martin child care / prek, https://capitalplanning.nyc.gov/facilities/explorer#18.56/40.68991/-73.95994
Helen Owen Carey, https://capitalplanning.nyc.gov/facilities/explorer#17.99/40.67703/-73.97798
Farragut Houses Cornerstone Program, https://capitalplanning.nyc.gov/facilities/explorer#17.08/40.70062/-73.98213